[
  {
    "id": "csat-sov1-01-c1",
    "sov_domain": "SOV-1",
    "criterion_type": "C",
    "layer": "legal_jurisdiction",
    "derivation": "verbatim",
    "source_refs": [
      {
        "framework": "C3A",
        "section_id": "SOV-1-01-C1"
      }
    ],
    "source_pointer": {
      "document": "BSI C3A v1.0 (27.04.2026)",
      "section": "SOV-1-01-C1",
      "page": 7
    },
    "source_text": {
      "en": "SEE-LOCAL-VERBATIM",
      "fr": "SEE-LOCAL-VERBATIM"
    },
    "generalized_text": {
      "en": "GENERALIZATION-PENDING",
      "fr": "GENERALIZATION-PENDING"
    },
    "disposition_default": "assess",
    "evidence_quality_options": [
      "self_attested",
      "contractual_commitment",
      "third_party_certified",
      "independently_audited"
    ],
    "weight": 1.0,
    "needs_review": false,
    "localization_level": "C1"
  },
  {
    "id": "csat-sov1-01-c2",
    "sov_domain": "SOV-1",
    "criterion_type": "C",
    "layer": "legal_jurisdiction",
    "derivation": "verbatim",
    "source_refs": [
      {
        "framework": "C3A",
        "section_id": "SOV-1-01-C2"
      }
    ],
    "source_pointer": {
      "document": "BSI C3A v1.0 (27.04.2026)",
      "section": "SOV-1-01-C2",
      "page": 7
    },
    "source_text": {
      "en": "SEE-LOCAL-VERBATIM",
      "fr": "SEE-LOCAL-VERBATIM"
    },
    "generalized_text": {
      "en": "GENERALIZATION-PENDING",
      "fr": "GENERALIZATION-PENDING"
    },
    "disposition_default": "assess",
    "evidence_quality_options": [
      "self_attested",
      "contractual_commitment",
      "third_party_certified",
      "independently_audited"
    ],
    "weight": 1.0,
    "needs_review": false,
    "localization_level": "C2"
  },
  {
    "id": "csat-sov1-02-c1",
    "sov_domain": "SOV-1",
    "criterion_type": "C",
    "layer": "legal_jurisdiction",
    "derivation": "verbatim",
    "source_refs": [
      {
        "framework": "C3A",
        "section_id": "SOV-1-02-C1"
      }
    ],
    "source_pointer": {
      "document": "BSI C3A v1.0 (27.04.2026)",
      "section": "SOV-1-02-C1",
      "page": 7
    },
    "source_text": {
      "en": "SEE-LOCAL-VERBATIM",
      "fr": "SEE-LOCAL-VERBATIM"
    },
    "generalized_text": {
      "en": "GENERALIZATION-PENDING",
      "fr": "GENERALIZATION-PENDING"
    },
    "disposition_default": "assess",
    "evidence_quality_options": [
      "self_attested",
      "contractual_commitment",
      "third_party_certified",
      "independently_audited"
    ],
    "weight": 1.0,
    "needs_review": false,
    "localization_level": "C1"
  },
  {
    "id": "csat-sov1-02-c2",
    "sov_domain": "SOV-1",
    "criterion_type": "C",
    "layer": "legal_jurisdiction",
    "derivation": "verbatim",
    "source_refs": [
      {
        "framework": "C3A",
        "section_id": "SOV-1-02-C2"
      }
    ],
    "source_pointer": {
      "document": "BSI C3A v1.0 (27.04.2026)",
      "section": "SOV-1-02-C2",
      "page": 7
    },
    "source_text": {
      "en": "SEE-LOCAL-VERBATIM",
      "fr": "SEE-LOCAL-VERBATIM"
    },
    "generalized_text": {
      "en": "GENERALIZATION-PENDING",
      "fr": "GENERALIZATION-PENDING"
    },
    "disposition_default": "assess",
    "evidence_quality_options": [
      "self_attested",
      "contractual_commitment",
      "third_party_certified",
      "independently_audited"
    ],
    "weight": 1.0,
    "needs_review": false,
    "localization_level": "C2"
  },
  {
    "id": "csat-sov1-03-c1",
    "sov_domain": "SOV-1",
    "criterion_type": "C",
    "layer": "legal_jurisdiction",
    "derivation": "verbatim",
    "source_refs": [
      {
        "framework": "C3A",
        "section_id": "SOV-1-03-C1"
      }
    ],
    "source_pointer": {
      "document": "BSI C3A v1.0 (27.04.2026)",
      "section": "SOV-1-03-C1",
      "page": 7
    },
    "source_text": {
      "en": "SEE-LOCAL-VERBATIM",
      "fr": "SEE-LOCAL-VERBATIM"
    },
    "generalized_text": {
      "en": "GENERALIZATION-PENDING",
      "fr": "GENERALIZATION-PENDING"
    },
    "disposition_default": "assess",
    "evidence_quality_options": [
      "self_attested",
      "contractual_commitment",
      "third_party_certified",
      "independently_audited"
    ],
    "weight": 1.0,
    "needs_review": false,
    "localization_level": "C1"
  },
  {
    "id": "csat-sov1-03-c2",
    "sov_domain": "SOV-1",
    "criterion_type": "C",
    "layer": "legal_jurisdiction",
    "derivation": "verbatim",
    "source_refs": [
      {
        "framework": "C3A",
        "section_id": "SOV-1-03-C2"
      }
    ],
    "source_pointer": {
      "document": "BSI C3A v1.0 (27.04.2026)",
      "section": "SOV-1-03-C2",
      "page": 7
    },
    "source_text": {
      "en": "SEE-LOCAL-VERBATIM",
      "fr": "SEE-LOCAL-VERBATIM"
    },
    "generalized_text": {
      "en": "GENERALIZATION-PENDING",
      "fr": "GENERALIZATION-PENDING"
    },
    "disposition_default": "assess",
    "evidence_quality_options": [
      "self_attested",
      "contractual_commitment",
      "third_party_certified",
      "independently_audited"
    ],
    "weight": 1.0,
    "needs_review": false,
    "localization_level": "C2"
  },
  {
    "id": "csat-sov1-04-c",
    "sov_domain": "SOV-1",
    "criterion_type": "C",
    "layer": "legal_jurisdiction",
    "derivation": "verbatim",
    "source_refs": [
      {
        "framework": "C3A",
        "section_id": "SOV-1-04-C"
      }
    ],
    "source_pointer": {
      "document": "BSI C3A v1.0 (27.04.2026)",
      "section": "SOV-1-04-C",
      "page": 8
    },
    "source_text": {
      "en": "SEE-LOCAL-VERBATIM",
      "fr": "SEE-LOCAL-VERBATIM"
    },
    "generalized_text": {
      "en": "GENERALIZATION-PENDING",
      "fr": "GENERALIZATION-PENDING"
    },
    "disposition_default": "assess",
    "evidence_quality_options": [
      "self_attested",
      "contractual_commitment",
      "third_party_certified",
      "independently_audited"
    ],
    "weight": 1.0,
    "needs_review": false
  },
  {
    "id": "csat-sov2-01-c",
    "sov_domain": "SOV-2",
    "criterion_type": "C",
    "layer": "legal_jurisdiction",
    "derivation": "verbatim",
    "source_refs": [
      {
        "framework": "C3A",
        "section_id": "SOV-2-01-C"
      }
    ],
    "source_pointer": {
      "document": "BSI C3A v1.0 (27.04.2026)",
      "section": "SOV-2-01-C",
      "page": 8
    },
    "source_text": {
      "en": "SEE-LOCAL-VERBATIM",
      "fr": "SEE-LOCAL-VERBATIM"
    },
    "generalized_text": {
      "en": "GENERALIZATION-PENDING",
      "fr": "GENERALIZATION-PENDING"
    },
    "disposition_default": "assess",
    "evidence_quality_options": [
      "self_attested",
      "contractual_commitment",
      "third_party_certified",
      "independently_audited"
    ],
    "weight": 1.0,
    "needs_review": false
  },
  {
    "id": "csat-sov2-02-c1",
    "sov_domain": "SOV-2",
    "criterion_type": "C",
    "layer": "legal_jurisdiction",
    "derivation": "verbatim",
    "source_refs": [
      {
        "framework": "C3A",
        "section_id": "SOV-2-02-C1"
      }
    ],
    "source_pointer": {
      "document": "BSI C3A v1.0 (27.04.2026)",
      "section": "SOV-2-02-C1",
      "page": 8
    },
    "source_text": {
      "en": "SEE-LOCAL-VERBATIM",
      "fr": "SEE-LOCAL-VERBATIM"
    },
    "generalized_text": {
      "en": "GENERALIZATION-PENDING",
      "fr": "GENERALIZATION-PENDING"
    },
    "disposition_default": "assess",
    "evidence_quality_options": [
      "self_attested",
      "contractual_commitment",
      "third_party_certified",
      "independently_audited"
    ],
    "weight": 1.0,
    "needs_review": false,
    "localization_level": "C1"
  },
  {
    "id": "csat-sov2-02-c2",
    "sov_domain": "SOV-2",
    "criterion_type": "C",
    "layer": "legal_jurisdiction",
    "derivation": "verbatim",
    "source_refs": [
      {
        "framework": "C3A",
        "section_id": "SOV-2-02-C2"
      }
    ],
    "source_pointer": {
      "document": "BSI C3A v1.0 (27.04.2026)",
      "section": "SOV-2-02-C2",
      "page": 8
    },
    "source_text": {
      "en": "SEE-LOCAL-VERBATIM",
      "fr": "SEE-LOCAL-VERBATIM"
    },
    "generalized_text": {
      "en": "GENERALIZATION-PENDING",
      "fr": "GENERALIZATION-PENDING"
    },
    "disposition_default": "assess",
    "evidence_quality_options": [
      "self_attested",
      "contractual_commitment",
      "third_party_certified",
      "independently_audited"
    ],
    "weight": 1.0,
    "needs_review": false,
    "localization_level": "C2"
  },
  {
    "id": "csat-sov2-03-c1",
    "sov_domain": "SOV-2",
    "criterion_type": "C",
    "layer": "legal_jurisdiction",
    "derivation": "verbatim",
    "source_refs": [
      {
        "framework": "C3A",
        "section_id": "SOV-2-03-C1"
      }
    ],
    "source_pointer": {
      "document": "BSI C3A v1.0 (27.04.2026)",
      "section": "SOV-2-03-C1",
      "page": 8
    },
    "source_text": {
      "en": "SEE-LOCAL-VERBATIM",
      "fr": "SEE-LOCAL-VERBATIM"
    },
    "generalized_text": {
      "en": "GENERALIZATION-PENDING",
      "fr": "GENERALIZATION-PENDING"
    },
    "disposition_default": "assess",
    "evidence_quality_options": [
      "self_attested",
      "contractual_commitment",
      "third_party_certified",
      "independently_audited"
    ],
    "weight": 1.0,
    "needs_review": true,
    "localization_level": "C1",
    "needs_review_note": "Spans legal_jurisdiction (the right to take over), facility (physical assets), and operations_personnel (personnel handover); tagged legal_jurisdiction as the primary overarching obligation since the requirement is fundamentally a legal enablement duty. Review whether Phase 4's disposition rules need a multi-layer treatment instead."
  },
  {
    "id": "csat-sov2-03-c2",
    "sov_domain": "SOV-2",
    "criterion_type": "C",
    "layer": "legal_jurisdiction",
    "derivation": "verbatim",
    "source_refs": [
      {